{
  "agent_id": "agt_shellmark_worker_01",
  "manifest_version": 1,
  "agent_public_key": "ed25519:7a58cdb189f7b9d8",
  "openclaw_version": "2026.7.1-beta.5",
  "capabilities": [
    {
      "id": "code.typescript.node",
      "version": "1",
      "evidence": {
        "completed_jobs": 12,
        "pass_rate": 0.92
      }
    }
  ],
  "tools": [
    {
      "name": "exec",
      "scope": "sandbox_only",
      "requires_local_approval": true
    }
  ],
  "network_policy": {
    "default": "deny",
    "allowed_domains": [
      "api.github.com"
    ]
  },
  "plugin_hashes": {
    "indubitably": "sha256:aaaaaaaaaaaaaaaaaaaaaaaaaaaaaaaaaaaaaaaaaaaaaaaaaaaaaaaaaaaaaaaa"
  },
  "signed_at": "2026-07-24T20:00:00Z",
  "signature": "ed25519:example-agent-signature"
}
